{
  "plan_version": "1.0",
  "product_id": "new-asset-studio",
  "source_brief_sha256": "6ee987eed23eca53ef9146e64c80da53a42cd8dff8da6351fbe1898f68a9cec4",
  "generator": "offline-heuristic",
  "model": null,
  "requirement_classification": {
    "must": [
      {
        "id": "REQ-001",
        "text": "一款面向独立游戏团队的全新资产管理应用，集中管理贴图、模型和音频，并支持标签筛选",
        "authority": "source-stated"
      },
      {
        "id": "REQ-002",
        "text": "用户按类型和标签筛选游戏资产，选择素材查看详情",
        "authority": "source-stated"
      }
    ],
    "may": [
      "Navigation and layout can be proposed unless explicitly constrained.",
      "Control positions, interaction feedback, colors and visual hierarchy are design proposals."
    ],
    "unknown": [
      "actor",
      "interaction design",
      "UI layout",
      "visual style",
      "visible feedback"
    ],
    "use_case_steps": [
      "UC-001:STEP-001",
      "UC-001:STEP-002",
      "UC-001:STEP-003"
    ]
  },
  "design_bundle": {
    "schema_version": "1.0",
    "brief": {
      "schema_version": "1.0",
      "product_id": "new-asset-studio",
      "name": "Asset Studio",
      "category": "desktop",
      "concept": "一款面向独立游戏团队的全新资产管理应用，集中管理贴图、模型和音频，并支持标签筛选",
      "requirements": [
        {
          "id": "REQ-001",
          "text": "一款面向独立游戏团队的全新资产管理应用，集中管理贴图、模型和音频，并支持标签筛选",
          "source": "user-prompt",
          "authority": "source-stated",
          "use_case_ids": []
        },
        {
          "id": "REQ-002",
          "text": "用户按类型和标签筛选游戏资产，选择素材查看详情",
          "source": "user-prompt",
          "authority": "source-stated",
          "use_case_ids": [
            "UC-001"
          ]
        }
      ],
      "hard_constraints": [],
      "use_cases": [
        {
          "id": "UC-001",
          "title": "用户按类型和标签筛选游戏资产，选择素材查看详情",
          "actor": "unspecified",
          "goal": "用户按类型和标签筛选游戏资产，选择素材查看详情",
          "steps": [
            {
              "id": "STEP-001",
              "action": "用户按标签筛选游戏素材，查看匹配的贴图和模型",
              "state": "in-progress",
              "flow": "main",
              "ui_text": [
                "筛选"
              ],
              "visible_evidence": [
                "筛选条件",
                "筛选后的素材列表"
              ]
            },
            {
              "id": "STEP-002",
              "action": "用户选中一条模型素材并查看缩略预览和元数据",
              "state": "in-progress",
              "flow": "main",
              "ui_text": [
                "详情"
              ],
              "visible_evidence": [
                "当前素材选中态",
                "素材预览区域",
                "素材属性区"
              ]
            },
            {
              "id": "STEP-003",
              "action": "用户保存素材标签修改时发生命名冲突，界面提示保存失败",
              "state": "failure",
              "flow": "exception",
              "ui_text": [
                "保存失败"
              ],
              "visible_evidence": [
                "被编辑的素材标签",
                "与当前素材关联的错误提示"
              ]
            }
          ]
        }
      ],
      "unknowns": [
        "actor",
        "interaction design",
        "UI layout",
        "visual style",
        "visible feedback"
      ],
      "origin": {
        "mode": "curated",
        "source_id": "benchmarks/new-products/fictional-WP02"
      }
    },
    "decisions": [
      {
        "schema_version": "1.0",
        "id": "DES-01-01",
        "product_id": "new-asset-studio",
        "topic": "Layout and panel structure",
        "proposal": "工作区主视图与左侧导航、右侧上下文属性面板",
        "rationale": "信息密集，便于查看对象细节；主视图空间略小",
        "status": "proposed",
        "locked": false,
        "revision": 1,
        "source": "ai-proposal",
        "related_use_case_ids": [],
        "effects": [
          {
            "key": "ui.layout",
            "value": "工作区主视图与左侧导航、右侧上下文属性面板"
          }
        ]
      },
      {
        "schema_version": "1.0",
        "id": "DES-01-02",
        "product_id": "new-asset-studio",
        "topic": "Navigation and interaction pattern",
        "proposal": "sidebar-workspace-inspector",
        "rationale": "信息密集，便于查看对象细节；主视图空间略小",
        "status": "proposed",
        "locked": false,
        "revision": 1,
        "source": "ai-proposal",
        "related_use_case_ids": [],
        "effects": [
          {
            "key": "ui.navigation",
            "value": "sidebar-workspace-inspector"
          }
        ]
      },
      {
        "schema_version": "1.0",
        "id": "DES-01-03",
        "product_id": "new-asset-studio",
        "topic": "Visual styling and rendering language",
        "proposal": "原创桌面/网页软件的纯应用内部界面，信息层级清晰、主任务突出、文本对比合理",
        "rationale": "信息密集，便于查看对象细节；主视图空间略小",
        "status": "proposed",
        "locked": false,
        "revision": 1,
        "source": "ai-proposal",
        "related_use_case_ids": [],
        "effects": [
          {
            "key": "ui.visual_style",
            "value": "原创桌面/网页软件的纯应用内部界面，信息层级清晰、主任务突出、文本对比合理"
          }
        ]
      },
      {
        "schema_version": "1.0",
        "id": "DES-02-01",
        "product_id": "new-asset-studio",
        "topic": "Layout and panel structure",
        "proposal": "顶部全局搜索和居中结果工作区、可展开详情抽屉",
        "rationale": "搜索效率高且聚焦内容；依赖抽屉组织高级操作",
        "status": "proposed",
        "locked": false,
        "revision": 1,
        "source": "ai-proposal",
        "related_use_case_ids": [],
        "effects": [
          {
            "key": "ui.layout",
            "value": "顶部全局搜索和居中结果工作区、可展开详情抽屉"
          }
        ]
      },
      {
        "schema_version": "1.0",
        "id": "DES-02-02",
        "product_id": "new-asset-studio",
        "topic": "Navigation and interaction pattern",
        "proposal": "search-grid-detail-drawer",
        "rationale": "搜索效率高且聚焦内容；依赖抽屉组织高级操作",
        "status": "proposed",
        "locked": false,
        "revision": 1,
        "source": "ai-proposal",
        "related_use_case_ids": [],
        "effects": [
          {
            "key": "ui.navigation",
            "value": "search-grid-detail-drawer"
          }
        ]
      },
      {
        "schema_version": "1.0",
        "id": "DES-02-03",
        "product_id": "new-asset-studio",
        "topic": "Visual styling and rendering language",
        "proposal": "原创桌面/网页软件的纯应用内部界面，信息层级清晰、主任务突出、文本对比合理",
        "rationale": "搜索效率高且聚焦内容；依赖抽屉组织高级操作",
        "status": "proposed",
        "locked": false,
        "revision": 1,
        "source": "ai-proposal",
        "related_use_case_ids": [],
        "effects": [
          {
            "key": "ui.visual_style",
            "value": "原创桌面/网页软件的纯应用内部界面，信息层级清晰、主任务突出、文本对比合理"
          }
        ]
      }
    ],
    "scenes": [
      {
        "schema_version": "1.0",
        "id": "new-asset-studio--UC-001--STEP-001",
        "product_id": "new-asset-studio",
        "use_case_id": "UC-001",
        "step_id": "STEP-001",
        "action": "用户按标签筛选游戏素材，查看匹配的贴图和模型",
        "state": "in-progress",
        "flow": "main",
        "frame_scope": "software-only",
        "viewpoint_mode": "application-ui",
        "design_status": "unresolved",
        "requirement_ids": [
          "REQ-001",
          "REQ-002"
        ],
        "design_decision_ids": [],
        "visible_evidence": [
          "筛选条件",
          "筛选后的素材列表"
        ],
        "expected_ui_text": [
          "筛选"
        ],
        "proposed_elements": []
      },
      {
        "schema_version": "1.0",
        "id": "new-asset-studio--UC-001--STEP-002",
        "product_id": "new-asset-studio",
        "use_case_id": "UC-001",
        "step_id": "STEP-002",
        "action": "用户选中一条模型素材并查看缩略预览和元数据",
        "state": "in-progress",
        "flow": "main",
        "frame_scope": "software-only",
        "viewpoint_mode": "application-ui",
        "design_status": "unresolved",
        "requirement_ids": [
          "REQ-001",
          "REQ-002"
        ],
        "design_decision_ids": [],
        "visible_evidence": [
          "当前素材选中态",
          "素材预览区域",
          "素材属性区"
        ],
        "expected_ui_text": [
          "详情"
        ],
        "proposed_elements": []
      },
      {
        "schema_version": "1.0",
        "id": "new-asset-studio--UC-001--STEP-003",
        "product_id": "new-asset-studio",
        "use_case_id": "UC-001",
        "step_id": "STEP-003",
        "action": "用户保存素材标签修改时发生命名冲突，界面提示保存失败",
        "state": "failure",
        "flow": "exception",
        "frame_scope": "software-only",
        "viewpoint_mode": "application-ui",
        "design_status": "unresolved",
        "requirement_ids": [
          "REQ-001",
          "REQ-002"
        ],
        "design_decision_ids": [],
        "visible_evidence": [
          "被编辑的素材标签",
          "与当前素材关联的错误提示"
        ],
        "expected_ui_text": [
          "保存失败"
        ],
        "proposed_elements": []
      }
    ]
  },
  "candidates": [
    {
      "id": "VAR-01",
      "status": "proposed",
      "label": "workspace-sidebar",
      "design_decision_ids": [
        "DES-01-01",
        "DES-01-02",
        "DES-01-03"
      ],
      "tradeoff": "信息密集，便于查看对象细节；主视图空间略小",
      "layout": "工作区主视图与左侧导航、右侧上下文属性面板",
      "navigation": "sidebar-workspace-inspector",
      "visual_style": "原创桌面/网页软件的纯应用内部界面，信息层级清晰、主任务突出、文本对比合理",
      "controls": [
        "当前用例的核心操作控件",
        "任务对象及必要属性视图",
        "操作结果或异常反馈区域"
      ],
      "information_priority": [
        "当前任务对象或结果",
        "用例所需属性、筛选或编辑信息",
        "可执行操作及系统反馈"
      ],
      "feedback": "根据当前步骤的实际 state 和 flow 表达操作反馈，不预设成功；起始步骤示例：用户按标签筛选游戏素材，查看匹配的贴图和模型",
      "screens": [
        {
          "scene_id": "new-asset-studio--UC-001--STEP-001",
          "use_case_id": "UC-001",
          "step_id": "STEP-001",
          "state": "in-progress",
          "flow": "main",
          "required_evidence": [
            "筛选条件",
            "筛选后的素材列表"
          ],
          "required_ui_text": [
            "筛选"
          ],
          "requirement_ids": [